{
    "$schema": "https://crtm.bobliu.tech/config.schema.json",
    "watch": [
        {
            "from": "上海",
            "to": "北京",
            "date": "20241001",
            "trains": [
                {
                    "code": "G2",
                    "from": "上海",
                    "to": "北京南",
                    "seatCategory": ["二等座"],
                    "checkRoundTrip": false
                }
            ]
        }
    ],
    "notifications": [
        {
            "type": "Browser",
            "port": 12306
        }
    ],
    "interval": 15,
    "delay": 5
}
